"DESCRIPTION","DURATION IN MS","NAME","PARENT SUITE","START TIME","STATUS","STOP TIME","SUB SUITE","SUITE","TEST CLASS","TEST METHOD"
"","741","Should NOT create product when name is empty","sales-portal-api","Mon Dec 15 11:05:04 UTC 2025","passed","Mon Dec 15 11:05:05 UTC 2025","[API] [Sales Portal] [Products] > Creating products with invalid data","","",""
"","1074","Should NOT get all products with invalid token","sales-portal-api","Mon Dec 15 11:05:07 UTC 2025","passed","Mon Dec 15 11:05:08 UTC 2025","[API] [Sales Portal] [Products] > Get All Products > Negative","","",""
"","2715","Should get orders for customer with multiple orders","sales-portal-api","Mon Dec 15 11:04:41 UTC 2025","passed","Mon Dec 15 11:04:44 UTC 2025","[API] [Sales Portal] [Customers]","","",""
"","1310","Should NOT delete product with invalid token","sales-portal-api","Mon Dec 15 11:05:06 UTC 2025","passed","Mon Dec 15 11:05:07 UTC 2025","[API] [Sales Portal] [Products] > Delete product > Negative","","",""
"","1086","Should NOT get product by id with invalid token","sales-portal-api","Mon Dec 15 11:05:08 UTC 2025","passed","Mon Dec 15 11:05:10 UTC 2025","[API] [Sales Portal] [Products] > Get Product By Id > Negative","","",""
"","1409","Should NOT create order with all valid data (token, valid customerId, productId) and 6 products","sales-portal-api","Mon Dec 15 11:04:51 UTC 2025","passed","Mon Dec 15 11:04:52 UTC 2025","[API] [Sales Portal] [Orders] [Create]","","",""
"","1055","Should NOT get product by id with empty token","sales-portal-api","Mon Dec 15 11:05:08 UTC 2025","passed","Mon Dec 15 11:05:09 UTC 2025","[API] [Sales Portal] [Products] > Get Product By Id > Negative","","",""
"","2316","Should NOT unassign manager with invalid token","sales-portal-api","Mon Dec 15 11:04:55 UTC 2025","passed","Mon Dec 15 11:04:58 UTC 2025","[API] [Sales Portal] [Orders] [Unassign Manager]","","",""
"","2200","Should NOT update non-existent product","sales-portal-api","Mon Dec 15 11:05:10 UTC 2025","passed","Mon Dec 15 11:05:12 UTC 2025","[API] [Sales Portal] [Products] > Update product by ID > Negative","","",""
"","2192","Should assign manager with valid orderId, managerId and token","sales-portal-api","Mon Dec 15 11:04:48 UTC 2025","passed","Mon Dec 15 11:04:50 UTC 2025","[API] [Sales Portal] [Orders] [Assign Manager]","","",""
"","515","0 character name customer is not created","sales-portal-api","Mon Dec 15 11:04:37 UTC 2025","passed","Mon Dec 15 11:04:38 UTC 2025","[API] [Sales Portal] [Customers] > Creating customers with invalid data","","",""
"","388","Should NOT create product without manufacturer field","sales-portal-api","Mon Dec 15 11:05:04 UTC 2025","passed","Mon Dec 15 11:05:05 UTC 2025","[API] [Sales Portal] [Products] > Creating products with invalid data","","",""
"","1409","Create Customer","sales-portal-api","Mon Dec 15 11:04:34 UTC 2025","passed","Mon Dec 15 11:04:35 UTC 2025","[API] [Sales Portal] [Customers]","","",""
"","1703","Should get order for customer with one order","sales-portal-api","Mon Dec 15 11:04:41 UTC 2025","passed","Mon Dec 15 11:04:42 UTC 2025","[API] [Sales Portal] [Customers]","","",""
"","581","Customer without phone is not created","sales-portal-api","Mon Dec 15 11:04:39 UTC 2025","passed","Mon Dec 15 11:04:39 UTC 2025","[API] [Sales Portal] [Customers] > Creating customers with invalid data","","",""
"","754","Search by country","sales-portal-api","Mon Dec 15 11:04:43 UTC 2025","passed","Mon Dec 15 11:04:44 UTC 2025","[API] [Sales Portal] [Customers] Get Sorted > Search","","",""
"","973","Should NOT create order with 1 invalid productId","sales-portal-api","Mon Dec 15 11:04:52 UTC 2025","passed","Mon Dec 15 11:04:53 UTC 2025","[API] [Sales Portal] [Orders] [Create]","","",""
"","1157","Get Customer By Id","sales-portal-api","Mon Dec 15 11:04:41 UTC 2025","passed","Mon Dec 15 11:04:42 UTC 2025","[API] [Sales Portal] [Customers]","","",""
"","449","Should NOT assign manager with non-existent orderId","sales-portal-api","Mon Dec 15 11:04:48 UTC 2025","passed","Mon Dec 15 11:04:49 UTC 2025","[API] [Sales Portal] [Orders] [Assign Manager]","","",""
"","892","Should NOT update customer without token","sales-portal-api","Mon Dec 15 11:04:44 UTC 2025","passed","Mon Dec 15 11:04:45 UTC 2025","[API] [Sales Portal] [Customers] > NOT SMOKE","","",""
"","843","NOT create customer with invalid data","sales-portal-api","Mon Dec 15 11:04:34 UTC 2025","passed","Mon Dec 15 11:04:35 UTC 2025","[API] [Sales Portal] [Customers]","","",""
"","769","Create customer with 1 house","sales-portal-api","Mon Dec 15 11:04:36 UTC 2025","passed","Mon Dec 15 11:04:37 UTC 2025","[API] [Sales Portal] [Customers] > Creating customers with valid data","","",""
"","1416","Should NOT update order with non-existent customerId","sales-portal-api","Mon Dec 15 11:04:59 UTC 2025","passed","Mon Dec 15 11:05:01 UTC 2025","[API] [Sales Portal] [Orders] [Update]","","",""
"","510","0 flat of customer is not created","sales-portal-api","Mon Dec 15 11:04:38 UTC 2025","passed","Mon Dec 15 11:04:38 UTC 2025","[API] [Sales Portal] [Customers] > Creating customers with invalid data","","",""
"","955","Should create product when name contains a single space","sales-portal-api","Mon Dec 15 11:05:02 UTC 2025","passed","Mon Dec 15 11:05:03 UTC 2025","[API] [Sales Portal] [Products] > Creating products with valid data","","",""
"","910","Should NOT create product when notes length is 251 characters","sales-portal-api","Mon Dec 15 11:05:06 UTC 2025","passed","Mon Dec 15 11:05:07 UTC 2025","[API] [Sales Portal] [Products] > Creating products with invalid data","","",""
"","769","Create customer with 20 character length of city","sales-portal-api","Mon Dec 15 11:04:36 UTC 2025","passed","Mon Dec 15 11:04:36 UTC 2025","[API] [Sales Portal] [Customers] > Creating customers with valid data","","",""
